channel ,Title ,View Count,Like count
LXXkiUKDK4w,"Entertainment | Full Movie | Akshay Kumar, Tamannaah Bhatia, Johnny Lever",205536869,1353631
,ABS-CBN Entertainment,2873621,93020
Wn1dnpoTWRI,funny video 🤪//comedy video//#shorts #emotional #fun #funny #comedy #entertainment #viral,9929,284
CQFOW3pmL4M,Zendaya and Beyoncé Share SWEET Moment at Pharrell&#39;s Louis Vuitton Show,981835,5751
utQlaFdlN1U,Entertainment (feat. KC Rebell),93539382,1268962
,Entertainment Weekly,15567418,232696
voG07pt-KYI,ZAYN - Entertainer (Official Video),91024,2689
2vRdzTzR4tI,"Tera Naam Doon Full Video - Entertainment | Akshay Kumar, Tamannaah, Atif Aslam",263768,10254
v1GC2FpdwsE,🔴 የድንቅ ልጆቹ መሱድ ማይታመን ለዉጥና የተጠለፈችዉ ህፃን አስደንጋጭ ቪዲዮ - ዘቢባ ግርማ | Dallol Entertainment,31640683,208095
G1qy6uWPGjQ,LAGI2 CIPUNG DITINGGAL NONTON BOLA! RAFATHAR ASIK NONTON INDONESIA ARGENTINA BARENG PRESIDEN JOKOWI!,49413996,189850
VMpgb8WjoBc,"Johnny Johnny with Lyrics - Entertainment | Akshay Kumar, Tamannaah, Sachin Jigar",26246821,110971
eb0CfNa84Iw,Dogs Fighting With Prakash Raj &amp; Sonu Sood- Comedy Scenes | Entertainment | Hindi Film,17312467,171169
luRbeO6yRAY,"Entertainment | Akshay Kumar, Tamannaah Bhatia | Hindi Movie Part 5",11656341,65438
oo8VgjCkUVE,"Akshay Kumar Comedy Scenes | Back To Back Comedy | Entertainment | Tamannaah Bhatia, Johnny Lever|HD",8311966,73916
3JXCj6RK2B4,BECAUSE YOU LOVED ME - Voyage Entertainment,1157778,105286
f92Pa3DWsaw,"Veerey Di Wedding Full Video - Entertainment | Akshay Kumar, Tamannaah | Mika",116473,556
NJZ5YNrXMpE,drowning in entertainment: the age of distraction,17317962,105452
aHxw7foeJpE,Must Watch New Entertainment Top Funny Video 2023 😂 Superhit Comedy 2023 Episode 94 By @HaHaidea,5958805,27668
0BCRu68302I,"Climax Scene - Entertaiment | Entertainment Bollywood Movie | Akshay Kumar, Tamannaah, Johnny",52759991,348408
TlooH0epzD0,"Entertainment | Akshay Kumar, Tamannaah Bhatia | Hindi Movie Part 3",10426165,35962
IsPFDzAGb4A,Adam Lambert - For Your Entertainment,13628952,148402
Y6D1_ozC4Uw,New Entertainment Top Funny Video Best Comedy in 2023 Episode 55 By MK Fun TV,2359445,6783
rze8QYwWGMs,KRAVEN THE HUNTER – Official Red Band Trailer (HD),460784,17028
gVvqKkBEPcU,Must Watch New Entertainment Funny Video 2023 Top Funny Video 2023  Episode 58 By MK Fun TV,3740470,67430
UEBh5anv3IY,"CIPUNG KETEMU SAPI WARISO 1,3 TON?! RAFFI GAMAU KALAH LGSG PESEN SAPI SKLGS BELI MERAK DEMI CIPUNG",2811,221
xQNJVS63zbk,বরিশাইল্লা বিয়া বাড়ি | Bangla Funny Video | Family Entertainment bd | Desi Cid | Borishailla Natok,4620871,12527
0R-DYRpSNzU,Samuel L. Jackson Teases A &quot;Flawed&quot; Nick Fury in Marvel&#39;s &#39;Secret Invasion&#39; | Around The Table,7462740,35905
OfwqejMGtxk,Akshay Kumar Trying To Kill The Dog- Comedy Scenes | Entertainment | Hindi Film,34669299,63650
FVh-aDHV_fA,"Entertainment | Akshay Kumar, Tamannaah Bhatia | Hindi Movie Part 4",403248,5964
YEdNAzv1LD8,A Mountain of Entertainment | Mr. Garvey&#39;s Mountain Survival Skills | Paramount+,366204,24436
AM2-qp80ktY,Entertainment Ki Raat Housefull | Ep. 1 | किसे चुनेगी Archana अपना गेम पार्टनर? | Highlights,461576,16892
obP9hxYvoIU,"THE COUPLE - FAHMI RATU SALTING, FLASHBACK VIDEO PERTAMA KALI KETEMU",190272,2157
NUi9DjdvjXw,GANGSTERS prank On Strangers | Pranks In INDIA | ANS Entertainment 2023,21614030,377063
ZbLeTxDhcdg,Entertainment Ki Raat Housefull | Ep. 21 | Puneet ने उड़ाया Haarsh का मज़ाक | Highlight,184986,2549
frdtaxHJWGA,"FAMILY KA ENTERTAINMENT | Fun with family in Kitchen, Terrace and Car | Aayu and Pihu Show",13896432,61852
YOEmgt8cSEo,Entertainment Ki Raat Housefull | Everyday 10PM |Colors,62014,732
m-H0uIH5HHQ,The Jam - That&#39;s Entertainment,61432,7282
S9ozGCzkmEQ,The &#39;Ted Lasso&#39; Cast Plays &#39;Who Said It?&#39; | Entertainment Weekly,2142672,119791
ZR9cH-pM9BE,ABWONI LOVE STORY 🤣🤣🤣MININA TWISWIMN,94047877,335708
THhxpGCpWL8,Did you notice this mistake in Frozen? #shorts #disney #entertainment,1604957,17641
ocWoH6Nyud4,Must Watch New Entertainment Funny Video 2022 New Funny Video 2022 Top Video Episode 07 By MK Fun TV,9288857,43158
cmkwx22ZmbA,"Teri Mahima Aprampaar Full Video - Entertainment | Akshay Kumar, Tamannaah | Anushka, Udit",2392629,9172
ua8JbIn2uBc,"Entertainment | Akshay Kumar, Tamannaah Bhatia | Hindi Movie Part 8",256693,3215
A8x71Dt6zGM,"Teri Mahima Aprampaar - It&#39;s Entertainment | Akshay Kumar, Tamannaah - Latest Bollywood Song 2014",370667,9584
Lbin1luRwEo,Teri Mahima Aprampaar | Akshay Kumar | Tamannaah | Anushka | Udit Narayan | Entertainment,2475941,36012
hXms_CdRdvA,Karma Phalam ( Ikru x Maman Part 9 ) | Malayalam Vine | Ikru,4290966,6854
URLnnMkx9hc,Akshay Kumar&#39;s Comedy Scene With Shreyas Talpade | Entertainment Hindi Movie,756811,45669
9uyS14YN3MI,Siyaah Series | Official Trailer | New Drama | Green TV| Watch Test Transmission on your Television.,11741784,89952
ibYwu-3iYio,BIDESH KANDA (nisturi sathi) | Garima Entertainment,2023-04-23T12:53:02Z,
32X3y2REoIc,"Tera Naam Doon - Its Entertainment | Akshay Kumar, Tamannaah, Atif Aslam | Latest Song Video",2014-06-24T08:25:32Z,